{
  "format": "pyWellSFM.RealizationData",
  "version": "1.0",
  "well": {
    "format": "pyWellSFM.WellData",
    "version": "1.0",
    "well": {
      "name": "RealizationWellInline",
      "location": {"x": 1.0, "y": 1.0, "z": 0.0},
      "depth": 120.0
    }
  },
  "initialBathymetry": 15.0,
  "subsidenceCurve": {
    "type": "cumulative",
    "curve": {
      "format": "pyWellSFM.CurveData",
      "version": "1.0",
      "curve": {
        "xAxisName": "Age",
        "yAxisName": "Subsidence",
        "interpolationMethod": "linear",
        "data": [
          {"x": 0.0, "y": 0.0},
          {"x": 10.0, "y": 50.0}
        ]
      }
    }
  }
}
